### ISSUE TITLE
options['headers'] not being used

### ISSUE THREAD

**Issue by btv** [pycontribs/jira#702]
I can confirm that this bug happens with version 2.0.0, which is latest release in the cheese shop.

**Describe the bug**
When connecting to a jira server, the headers in JIRA_Instance._options['headers'] are not getting used.

**To Reproduce**
```
from jira import JIRA
j = JIRA("SERVERNAME")
j._options
{u'agile_rest_api_version': u'1.0',
 u'agile_rest_path': u'greenhopper',
 u'async': False,
 u'async_workers': 5,
 u'auth_url': u'/rest/auth/1/session',
 u'check_update': False,
 u'client_cert': None,
 u'context_path': u'/',
 u'headers': {u'Cache-Control': u'no-cache',
  u'Content-Type': u'application/json',
  u'X-Atlassian-Token': u'no-check'},
 u'resilient': True,
 u'rest_api_version': u'2',
 u'rest_path': u'api',
 u'server': 'SERVERNAME',
 u'verify': True}
new_header = {"someheader": "somedata"}
j._options['headers'].update(new_header.copy())
{u'agile_rest_api_version': u'1.0',
 u'agile_rest_path': u'greenhopper',
 u'async': False,
 u'async_workers': 5,
 u'auth_url': u'/rest/auth/1/session',
 u'check_update': False,
 u'client_cert': None,
 u'context_path': u'/',
 u'headers': {u'Cache-Control': u'no-cache',
  u'Content-Type': u'application/json',
  u'X-Atlassian-Token': u'no-check',
  u'someheader': 'somedata'},
 u'resilient': True,
 u'rest_api_version': u'2',
 u'rest_path': u'api',
 u'server': 'SERVERNAME',
 u'verify': True}
```
Now, when you connect to the server to get an issue:
```
j.issue('SOMEPROJECT-SOMENUMBER')
```

You should see the header within a tcpdump or wireshark. However, you don't, you only see:
```
Frame 1: 347 bytes on wire (2776 bits), 347 bytes captured (2776 bits) on interface 0
Null/Loopback
Internet Protocol Version 4, Src: 10.63.92.70, Dst: 10.20.114.56
Transmission Control Protocol, Src Port: 59055, Dst Port: 8080, Seq: 1, Ack: 1, Len: 291
Hypertext Transfer Protocol
    GET /rest/api/2/issue/<ISSUE_NUMBER> HTTP/1.1\r\n
        [Expert Info (Chat/Sequence): GET <FULL_API_URL> HTTP/1.1\r\n]
        Request Method: GET
        Request URI: <API_URL>
        Request Version: HTTP/1.1
    Host: jira-api-vip.snc1:8080\r\n
    Connection: keep-alive\r\n
    Accept-Encoding: gzip, deflate\r\n
    Accept: application/json,*.*;q=0.9\r\n
    User-Agent: python-requests/2.18.4\r\n
    Content-Type: application/json\r\n
    X-Atlassian-Token: no-check\r\n
    Cache-Control: no-cache\r\n
    \r\n
    [Full request URI: http:STUFF]
    [HTTP request 1/1]
    [Response in frame: 3]
```

**Expected behavior**
The headers in the JIRA instance should be used.

**Version Information**
Python Interpreter: 2.7.15
jira-python: 2.0.0
OS: OSX
IPython (Optional): IPython 5.7.0
Other Dependencies:

**Comment by hdost** [comment]
Given that you are modifying what is not considered to be part of the Public API I would not consider this a bug.

@ssbarnea Thoughts?

**Comment by hdost** [comment]
@btv The class uses the same session after initialization, so what your describing will not work. While I do _not_ recommend it.  Your best option would be to:
```
client._session.headers.update(new_header.copy())
```
This should do what I believe you are attempting. Additionally, if you just set them from the beginning with something like:
```
from jira import JIRA
options={
    "headers": {
        "some_header": "some_value"
    }
}
client = JIRA("SERVER_URL",options=options)
```
